{"type":"config","name":"translator-speedup","metricName":"total_cpu","metricUnit":"s","bestDirection":"lower"}
{"run": 1, "commit": "71fa76e", "metric": 322.967, "samples": [326.403, 320.719, 322.967], "confidence": null, "status": "keep", "description": "baseline", "timestamp": 1780700150, "segment": 0}
{"run":2,"commit":"89a237c","metric":289.559,"samples":[289.559,290.927,287.425],"confidence":12.869,"status":"keep","description":"AtomView allocation-free fact probing in instantiate","timestamp":1780702441,"segment":0}
{"run":3,"commit":"89a237c","metric":286.970,"samples":[292.652,285.979,284.902,282.587,287.961,298.075],"confidence":0.844,"status":"discard","description":"raw-id packed join keys in compute_model key_of (within noise vs SSO string key)","timestamp":1780705305,"segment":0}
{"run":4,"commit":"31d9235","metric":280.822,"samples":[285.803,280.822,278.839],"confidence":3.517,"status":"keep","description":"reuse scratch buffer for literal arg resolution in instantiate","timestamp":1780707223,"segment":0}
{"run":5,"commit":"2b03d60","metric":268.700,"samples":[269.660,267.552,268.700],"confidence":7.757,"status":"keep","description":"skip per-effect var_mapping copy for parameterless effects","timestamp":1780708978,"segment":0}
{"run":6,"commit":"e588ed8","metric":265.6885,"samples":[267.015,265.697,264.422,266.558,265.680,262.897],"confidence":2.116,"status":"keep","description":"reuse key buffer for dict lookups in translate phase (pooled 6 samples)","timestamp":1780712308,"segment":0}
{"run":7,"commit":"ebae3a6","metric":259.733,"samples":[259.491,262.752,259.733],"confidence":4.62,"status":"keep","description":"reuse var_mapping scratch across ground actions in instantiate_action","timestamp":1780714034,"segment":0}
{"run":8,"commit":"ebae3a6","metric":261.898,"samples":[264.418,259.174,261.898],"confidence":1.057,"status":"discard","description":"cache predicate hash on Literal for AtomView probe (no improvement, predicate hashing not a bottleneck)","timestamp":1780715578,"segment":0}
{"run":9,"commit":"48fb50c","metric":260.223,"samples":[258.848,260.223,261.685],"confidence":0.409,"status":"keep","description":"drop redundant double-hash in UnionFind::find (metric-neutral simplification; comparison-best stays 259.73)","timestamp":1780717208,"segment":0}
{"run":10,"commit":"eb2baa5","metric":264.299,"samples":[265.878,262.370,264.299],"confidence":3.382,"status":"discard","description":"unordered_map for translate-phase effects maps (measurably WORSE: std::map faster for tiny per-op maps)","timestamp":1780730036,"segment":0}
{"type":"config","name":"autopolish","metricName":"total_cpu_subset","metricUnit":"s","bestDirection":"lower"}
{"run":1,"commit":"3a114cc","metric":166.591,"samples":[166.591,167.112,165.183],"confidence":null,"status":"keep","description":"autopolish baseline (subset runtime guard; translator code 48fb50c)","timestamp":1780739370,"segment":1}
{"run":2,"commit":"c2e3f68","metric":162.295,"samples":[161.838,162.880,162.295],"confidence":5.926,"status":"keep","description":"C++20 .contains() for count() membership checks (quality; byte-identical; guard neutral)","timestamp":1780740584,"segment":1}
{"run":3,"commit":"71cc14c","metric":164.389,"samples":[165.006,164.389,164.205],"confidence":4.213,"status":"keep","description":"C++20 .contains() for find()!=end() membership (quality; byte-identical; guard neutral)","timestamp":1780741785,"segment":1}
{"run":4,"commit":"2126410","metric":null,"samples":[],"confidence":null,"status":"keep","description":"std::erase_if + [[maybe_unused]] (C++20; byte-identical; runtime-neutral, guard skipped)","timestamp":1780742180,"segment":1}
{"run":5,"commit":"15b29ff","metric":163.549,"samples":[163.231,163.783,163.549],"confidence":7.434,"status":"keep","description":"std::ranges algorithms x43 (C++20; byte-identical; guard neutral)","timestamp":1780743416,"segment":1}
{"run":6,"commit":"bad2a75","metric":null,"samples":[],"confidence":null,"status":"keep","description":"std::iota for sequential fills (C++20-clean; byte-identical; neutral)","timestamp":1780743975,"segment":1}
{"run": 7, "commit": "1c949de", "metric": 147.073, "samples": [140.45, 147.897, 147.073], "confidence": 19.576, "status": "keep", "description": "axiom-dominance std::ranges::includes (O(m) subset) + allocation-free Atom::operator< (combined guard -11.7%, byte-identical)", "timestamp": 1781680444, "segment": 1}
